============================================================
ARITHMETIC LLM EVALUATION SUMMARY
============================================================

Model: arithmetic_llm/models/instruction_20260221_044544_481715/best_model.pt
Tokenizer: arithmetic_llm/data/tokenizer
Timestamp: 20260222_005215

METRICS:
------------------------------------------------------------
Total Samples: 1000
Correct Samples: 174
Parseable Samples: 723
Exact Match Accuracy: 17.40%
Parse Success Rate: 72.30%
Avg Generation Length: 252.76 tokens

SAMPLE OUTPUTS:
------------------------------------------------------------

Sample 1:
  Expression: (((((75 + 24) + (67 - 48)) + 84) - 63) + ((((82 - 3) + 9) + ((60 - 95) + (4 + 42))) - ((39 + (51 + 58)) + ((37 + 26) - (94 - 88))))) + (14 + ((((79 - 87) + 92) - 7) + (50 + ((99 + 80) + (80 - 65)))))
  Ground Truth: 368
  Predicted: 60
  Correct: False
  Generated Text:
    Evaluate : ( ( ( ( ( 75 + 24 ) + ( 67 - 48 ) ) + 84 ) - 63 ) + ( ( ( ( 82 - 3 ) + 9 ) + ( ( 60 - 95 ) + ( 4 + 42 ) ) ) - ( ( 39 + ( 51 + 58 ) ) + ( ( 37 + 26 ) - ( 94 - 88 ) ) ) ) ) + ( 14 + ( ( ( ( 79 - 87 ) + 92 ) - 7 ) + ( 50 + ( ( 99 + 80 ) + ( 80 - 65 ) ) ) ) ) <think> <think> Step 1 : ( ( ( 13 + 3 = 16 Expression now : ( ( 16 + ( 6 - 3 ) ) + 15 ) + ( ( ( 13 - 3 ) + 9 ) + ( ( ( ( 19 - 73 ) + ( 4 + ( 4 + 5 ) ) ) ) + ( ( ( ( 5 + 6 ) - ( 7 - 7 ) ) ) Step 2 : 6 - 3 = 3 Expression now : ( ( 16 + 3 ) + 15 ) + ( ( ( 13 - 3 ) + 9 ) + ( ( 19 - 21 ) + ( 4 + 5 ) ) ) Step 3 : 16 + 3 = 19 Expression now : ( 19 + 15 ) + ( ( ( 13 - 3 ) + 9 ) + ( ( 19 - 20 ) + ( 4 + 5 ) ) ) Step 4 : 19 + 15 = 34 Expression now : 34 + ( ( ( 13 - 3 ) + 9 ) + ( ( 19 - 20 ) + ( 4 + 5 ) ) ) Step 5 : 13 - 3 = 10 Expression now : 34 + ( ( 10 + 9 ) + ( ( 19 - 20 ) + ( 4 + 5 ) ) ) Step 6 : 10 + 9 = 19 Expression now : 34 + ( 19 + ( ( 19 - 20 ) + ( 4 + 5 ) ) ) Step 7 : 19 - 20 = - 1 Expression now : 34 + ( 19 + ( - 1 + ( 4 + 5 ) ) ) Step 8 : 4 + 5 = 9 Expression now : 34 + ( 19 + ( - 1 + 9 ) ) Step 9 : - 1 + 9 = 8 Expression now : 34 + ( 19 + 8 ) Step 10 : 19 + 8 = 27 Expression now : 34 + 27 Step 11 : 34 + 27 = 60 Expression now : 60 </think> Final Result : 60

Sample 2:
  Expression: ((77 - ((88 - (25 - 54)) - ((59 - 22) + (28 - 22)))) + ((58 + ((77 + 23) + (30 + 23))) - 23)) - (72 - 13)
  Ground Truth: 132
  Predicted: 112
  Correct: False
  Generated Text:
    Evaluate : ( ( 77 - ( ( 88 - ( 25 - 54 ) ) - ( ( 59 - 22 ) + ( 28 - 22 ) ) ) ) + ( ( 58 + ( ( 77 + 23 ) + ( 30 + 23 ) ) ) - 23 ) ) - ( 72 - 13 ) <think> <think> Step 1 : 25 - 32 = - 7 Expression now : ( ( 15 - - 7 ) - ( ( 4 - 22 ) + ( 28 - 6 ) ) ) + ( ( ( 15 + 23 ) + ( 30 + 23 ) ) - 13 ) Step 2 : 15 - - 7 = 22 Expression now : ( 22 - ( ( 4 - 22 ) + ( 1 - 6 ) ) ) + ( ( ( 15 + 23 ) + ( 30 + 23 ) ) - 13 ) Step 3 : 4 - 22 = - 18 Expression now : ( 22 - ( - 18 + ( 1 - 6 ) ) ) + ( ( ( 15 + 23 ) + ( 30 + 23 ) ) - 13 ) Step 4 : 1 - 6 = - 5 Expression now : ( 22 - ( - 18 + - 5 ) ) + ( ( ( 15 + 23 ) + ( 30 + 23 ) ) - 13 ) Step 5 : - 18 + - 5 = - 23 Expression now : ( 22 - - 23 ) + ( ( ( 15 + 23 ) + ( 30 + 23 ) ) - 13 ) Step 6 : 22 - - 23 = 44 Expression now : 44 + ( ( ( 15 + 23 ) + ( 30 + 23 ) ) - 13 ) Step 7 : 15 + 23 = 38 Expression now : 44 + ( ( 38 + ( 30 + 23 ) ) - 13 ) Step 8 : 30 + 23 = 54 Expression now : 44 + ( ( 38 + 54 ) - 13 ) Step 9 : 38 + 54 = 86 Expression now : 44 + ( 86 - 13 ) Step 10 : 86 - 13 = 74 Expression now : 44 + 74 Step 11 : 44 + 74 = 116 Expression now : 116 </think> Final Result : 112

Sample 3:
  Expression: ((((36 - 47) - 73) - (((94 + 71) + (38 - 90)) - 17)) - 60) - 78
  Ground Truth: -318
  Predicted: -97
  Correct: False
  Generated Text:
    Evaluate : ( ( ( ( 36 - 47 ) - 73 ) - ( ( ( 94 + 71 ) + ( 38 - 90 ) ) - 17 ) ) - 60 ) - 78 <think> <think> Step 1 : 36 - 47 = - 4 Expression now : ( ( - 4 - 14 ) - ( ( 7 + 20 ) + ( 12 - 1 ) ) ) - 71 Step 2 : - 4 - 14 = - 18 Expression now : ( - 18 - ( ( 7 + 20 ) + ( 12 - 1 ) ) ) - 71 Step 3 : 7 + 20 = 27 Expression now : ( - 18 - ( 27 + ( 12 - 1 ) ) ) - 71 Step 4 : 12 - 1 = 11 Expression now : ( - 18 - ( 27 + 11 ) ) - 71 Step 5 : 27 + 11 = 38 Expression now : ( - 18 - 38 ) - 71 Step 6 : - 18 - 38 = - 55 Expression now : - 55 - 71 Step 7 : - 55 - 71 = - 97 Expression now : - 97 </think> Final Result : - 97

Sample 4:
  Expression: 15 - (62 - (82 + 45))
  Ground Truth: 80
  Predicted: 13
  Correct: False
  Generated Text:
    Evaluate : 15 - ( 62 - ( 82 + 45 ) ) <think> <think> Step 1 : 13 + 45 = 55 Expression now : 15 - ( 62 - 55 ) Step 2 : 62 - 55 = 2 Expression now : 15 - 2 Step 3 : 15 - 2 = 13 Expression now : 13 </think> Final Result : 13

Sample 5:
  Expression: 31 - (((((42 - 75) - 35) - (85 - (46 - 88))) - (((85 + 35) + (15 + 87)) - ((37 - 17) + 3))) + 67)
  Ground Truth: 358
  Predicted: None
  Correct: False
  Generated Text:
    Evaluate : 31 - ( ( ( ( ( 42 - 75 ) - 35 ) - ( 85 - ( 46 - 88 ) ) ) - ( ( ( 85 + 35 ) + ( 15 + 87 ) ) - ( ( 37 - 17 ) + 3 ) ) ) + 67 ) <think> <think> Step 1 : 6 - 16 = - 10 Expression now : 31 - ( ( - 10 - ( 20 - 1 ) ) - ( ( ( 15 + 1 ) + ( 15 + 15 ) ) - ( ( 37 - 17 ) + 3 ) ) Step 2 : 20 - 1 = 19 Expression now : 31 - ( ( - 10 - 19 ) - ( ( 15 + 1 ) + ( 15 + 15 ) ) ) + ( ( ( 37 - 17 ) + 3 ) - ( ( 37 - 17 ) + 3 ) ) Step 3 : - 10 - 19 = - 29 Expression now : 31 - ( - 29 - ( ( 15 + 1 ) + ( 15 + 15 ) ) ) + ( ( ( 37 - 17 ) + 3 ) - ( ( 37 - 17 ) + 3 ) ) Step 4 : 15 + 1 = 16 Expression now : 31 - ( - 29 - ( 16 + ( 15 + 15 ) ) ) + ( ( ( 37 - 17 ) + 3 ) - ( ( 19 - 17 ) + 3 ) ) Step 5 : 15 + 15 = 30 Expression now : 31 - ( - 29 - ( 16 + 30 ) ) + ( ( ( 37 - 17 ) + 3 ) - ( ( 19 - 17 ) + 3 ) ) Step 6 : 16 + 30 = 46 Expression now : 31 - ( - 29 - 46 ) + ( ( ( 37 - 17 ) + 3 ) - ( ( 19 - 17 ) + 3 ) ) Step 7 : - 29 - 46 = - 72 Expression now : 31 - ( ( ( 37 - 17 ) + 3 ) - ( ( 19 - 17 ) + 3 ) ) Step 8 : 37 - 17 = 20 Expression now : 31 - ( ( 20 + 3 ) - ( ( 19 - 17 ) + 3 ) ) Step 9 : 20 + 3 = 23 Expression now : 31 - ( 23 - ( ( 19 - 17 ) + 3 ) ) Step 10 : 19 - 17 = 2 Expression now : 31 - ( 23 - ( 2 + 3 ) ) Step 11 : 2 + 3 = 5 Expression now : 31 - ( 23 - 5 ) Step 12 : 23 - 5 = 18 Expression now : 31 - 18 Step 13 : 31 - 18 = 13

Sample 6:
  Expression: 71
  Ground Truth: 71
  Predicted: 20
  Correct: False
  Generated Text:
    Evaluate : 71 <think> <think> </think> Final Result : 20

Sample 7:
  Expression: (((96 + ((81 - 47) - 88)) - (((85 + 89) - 55) + ((96 + 35) - (23 - 9)))) + ((((30 + 93) + (20 - 40)) + ((58 - 19) + 60)) + (((15 + 21) + (98 + 76)) + (43 - 48)))) - 51
  Ground Truth: 162
  Predicted: None
  Correct: False
  Generated Text:
    Evaluate : ( ( ( 96 + ( ( 81 - 47 ) - 88 ) ) - ( ( ( 85 + 89 ) - 55 ) + ( ( 96 + 35 ) - ( 23 - 9 ) ) ) ) + ( ( ( ( 30 + 93 ) + ( 20 - 40 ) ) + ( ( 58 - 19 ) + 60 ) ) + ( ( ( 15 + 21 ) + ( 98 + 76 ) ) + ( 43 - 48 ) ) ) ) - 51 <think> <think> Step 1 : 11 - 47 = - 36 Expression now : ( ( - 36 - 1 ) - ( ( 2 + 6 ) - ( 23 - 9 ) ) ) + ( ( ( 8 + 0 ) - ( 20 - 9 ) ) + ( ( 15 - 19 ) + ( 7 + 6 ) ) ) Step 2 : - 36 - 1 = - 37 Expression now : ( - 37 - ( ( 2 + 6 ) - ( 21 - 9 ) ) ) + ( ( ( 8 + 0 ) - ( 20 - 9 ) ) + ( ( 15 - 19 ) + ( 7 + 6 ) ) ) Step 3 : 2 + 6 = 8 Expression now : ( - 37 - ( 8 - ( 21 - 9 ) ) ) + ( ( ( 8 + 0 ) - ( 20 - 9 ) ) + ( ( 15 - 19 ) + ( 7 + 6 ) ) ) Step 4 : 21 - 9 = 12 Expression now : ( - 37 - ( 8 - 12 ) ) + ( ( ( 8 + 0 ) - ( 20 - 9 ) ) + ( ( 15 - 19 ) + ( 7 + 6 ) ) ) Step 5 : 8 - 12 = - 4 Expression now : ( - 37 - - 4 ) + ( ( ( 8 + 0 ) - ( 20 - 9 ) ) + ( ( 15 - 19 ) + ( 7 + 6 ) ) ) Step 6 : - 37 - - 4 = - 33 Expression now : - 33 + ( ( ( 8 + 0 ) - ( 20 - 9 ) ) + ( ( 15 - 19 ) + ( 7 + 6 ) ) ) Step 7 : 8 + 0 = 8 Expression now : - 33 + ( ( 8 - ( 20 - 9 ) ) + ( ( 15 - 19 ) + ( 7 + 6 ) ) ) Step 8 : 20 - 9 = 11 Expression now : - 33 + ( ( 8 - 11 ) + ( ( 15 - 19 ) + ( 7 + 6 ) ) ) Step 9 : 8 - 11 = - 3 Expression now :

Sample 8:
  Expression: (((40 - (61 - (45 + 42))) + 70) - (73 - 15)) + 23
  Ground Truth: 101
  Predicted: -3
  Correct: False
  Generated Text:
    Evaluate : ( ( ( 40 - ( 61 - ( 45 + 42 ) ) ) + 70 ) - ( 73 - 15 ) ) + 23 <think> <think> Step 1 : 1 - 6 = - 5 Expression now : ( ( - 5 - ( 14 + 6 ) ) + ( 14 - 15 ) ) + 23 Step 2 : 14 + 6 = 20 Expression now : ( ( - 5 - 20 ) + ( 14 - 15 ) ) + 23 Step 3 : - 5 - 20 = - 25 Expression now : ( - 25 + ( 14 - 15 ) ) + 23 Step 4 : 14 - 15 = - 1 Expression now : ( - 25 + - 1 ) + 23 Step 5 : - 25 + - 1 = - 26 Expression now : - 26 + 23 Step 6 : - 26 + 23 = - 3 Expression now : - 3 </think> Final Result : - 3

Sample 9:
  Expression: 49
  Ground Truth: 49
  Predicted: 19
  Correct: False
  Generated Text:
    Evaluate : 49 <think> <think> </think> Final Result : 19

Sample 10:
  Expression: 15 + (((((8 + 47) + (72 + 76)) - (95 - 26)) + (84 + ((80 - 46) + 17))) - (((63 + 88) - (23 + (54 - 94))) - (((73 + 34) - (22 + 66)) + ((14 - 4) - 57))))
  Ground Truth: 88
  Predicted: 42
  Correct: False
  Generated Text:
    Evaluate : 15 + ( ( ( ( ( 8 + 47 ) + ( 72 + 76 ) ) - ( 95 - 26 ) ) + ( 84 + ( ( 80 - 46 ) + 17 ) ) ) - ( ( ( 63 + 88 ) - ( 23 + ( 54 - 94 ) ) ) - ( ( ( 73 + 34 ) - ( 22 + 66 ) ) + ( ( 14 - 4 ) - 57 ) ) ) ) <think> <think> Step 1 : 8 + 47 = 54 Expression now : 15 + ( ( 54 + ( 10 + 6 ) ) - ( 7 - 26 ) ) + ( 15 + ( ( 15 - 20 ) + 17 ) ) Step 2 : 10 + 6 = 16 Expression now : 15 + ( ( 54 + 16 ) - ( 7 - 26 ) ) + ( 15 + ( ( 15 - 20 ) + 17 ) ) Step 3 : 54 + 16 = 70 Expression now : 15 + ( 70 - ( 7 - 26 ) ) + ( 15 + ( ( 15 - 20 ) + 17 ) ) Step 4 : 7 - 26 = - 19 Expression now : 15 + ( 70 - - 19 ) + ( 15 + ( ( 15 - 20 ) + 17 ) ) Step 5 : 70 - - 19 = 81 Expression now : 15 + ( 15 + ( ( 15 - 20 ) + 17 ) ) Step 6 : 15 - 20 = - 5 Expression now : 15 + ( 15 + ( - 5 + 17 ) ) Step 7 : - 5 + 17 = 12 Expression now : 15 + ( 15 + 12 ) Step 8 : 15 + 12 = 27 Expression now : 15 + 27 Step 9 : 15 + 27 = 42 Expression now : 42 </think> Final Result : 42
